placekey,location_name,top_category,naics_code,poi_cbg
222-223@8dy-qsc-9j9,Fleury of Wings,Restaurants and Other Eating Places,722511.0,220710025044.0
223-222@8dy-qv2-92k,John Dibert Community School,Elementary and Secondary Schools,611110.0,220710044012.0
223-222@8dy-qv5-zxq,Wasabi Sushi and Bar,Restaurants and Other Eating Places,722513.0,220710026001.0
223-224@8dy-qtz-ty9,Phillips Stephanie A DDS,Offices of Dentists,621210.0,220710134003.0
225-222@8dy-rfh-p9z,Ice Cream 504,Restaurants and Other Eating Places,722515.0,220710111001.0
226-222@8dy-r9d-vfz,Whole Foods Market,Grocery Stores,445110.0,220710114001.0
226-222@8dy-rbb-4jv,To The Glory Of God Ministry,Religious Organizations,813110.0,220710006182.0
226-222@8dy-rfj-rzf,French Truck Coffee,Restaurants and Other Eating Places,722515.0,220710109002.0
22b-222@8dy-qtz-nt9,SpringHill Suites by Marriott,Traveler Accommodation,721110.0,220710077001.0
22d-222@8dy-rfc-8qf,IBERIA BANK,Depository Credit Intermediation,522110.0,220510248002.0
22d-223@8dy-qv3-jjv,FreeWheelin' Bike Tours & Rentals,Consumer Goods Rental,532284.0,220710135001.0
22h-222@8dy-qv2-wff,Mickey's Playhouse,Drinking Places (Alcoholic Beverages),722410.0,220710035001.0
22h-222@8dy-r9d-vpv,Pied Nu,"Jewelry, Luggage, and Leather Goods Stores",448310.0,220710116001.0
22j-222@8dy-rf7-2tv,Fish In the Land of Giants,Other Amusement and Recreation Industries,713940.0,220710128003.0
22k-222@8dy-rbc-xbk,The Southern Fly,Other Amusement and Recreation Industries,713940.0,220710006181.0
22s-222@8dy-rf6-n89,Captain's Vinyl,"Sporting Goods, Hobby, and Musical Instrument Stores",451120.0,220710132003.0
22t-222@8dy-qtz-yn5,Love Outreach Christian Church,Religious Organizations,813110.0,220710002002.0
22v-222@8dy-rfc-8gk,Mirabella,Clothing Stores,4481.0,220510224002.0
22x-222@8dy-qtz-68v,ServiceMaster,Services to Buildings and Dwellings,561720.0,220710001001.0
233-222@8dy-qv4-3kf,Bon Castor,"Office Supplies, Stationery, and Gift Stores",453220.0,220710013012.0
zzw-222@8dy-qv6-z4v,The UPS Store,Couriers and Express Delivery Services,492110.0,220710077001.0
zzw-222@8dy-qv8-xqz,Blue Line Sandwich,Restaurants and Other Eating Places,722513.0,220710134003.0
zzw-222@8dy-qvn-k4v,Salon M,Personal Care Services,812112.0,220710065002.0
zzw-222@8dy-qvq-z2k,St Bernard Community Baptist Church,Religious Organizations,813110.0,220710138003.0
zzw-222@8dy-r4j-9j9,Tire Squad,"Automotive Parts, Accessories, and Tire Stores",441320.0,220710017472.0
zzw-222@8dy-rf7-rff,Carrollton Cemetery,Death Care Services,812220.0,220710127002.0
zzw-222@8dy-rfb-2tv,,,,220710070002.0
zzw-222@8dy-rfb-gx5,China Kitchen,Restaurants and Other Eating Places,722511.0,220710072002.0
zzw-222@8dy-rfj-dvz,St Thomas American Episcopal Church Of Louisiana Inc,Religious Organizations,813110.0,220710109002.0
zzw-223@8dy-qv8-qj9,Etre Cosmetic Dermatology & Laser Center,Offices of Physicians,621111.0,220710139001.0
zzw-225@8dy-r9h-vj9,Aline Street Beer Garden,Drinking Places (Alcoholic Beverages),722410.0,220710099001.0
zzy-222@8dy-qvh-975,Bucktown Burger & Fish Co,Restaurants and Other Eating Places,722511.0,220510201011.0
zzy-222@8dy-qvq-3kf,Lake Lawn Park Cemetery,Death Care Services,812220.0,220710076041.0
zzz-222@8dy-qsc-45f,Barrow Stadium,Other Amusement and Recreation Industries,713940.0,220710017012.0
zzz-222@8dy-rbb-wc5,Brechtel Park,"Museums, Historical Sites, and Similar Institutions",712190.0,220710006181.0
zzz-222@8dy-rfd-vvf,Eastbank Mrt To Audubon,"Museums, Historical Sites, and Similar Institutions",712190.0,220710125002.0
222-222@8dy-qtw-7kf,Burger King,Restaurants and Other Eating Places,722513.0,220710017472.0
222-222@8f5-2h7-87q,Trinity Presbyterian Church,Religious Organizations,813110.0,221030407082.0
223-222@8dy-rbb-649,The Society Of Clerks Secular Of Saint Basil,Religious Organizations,813110.0,220710006181.0
223-222@8dy-rfb-gtv,24 7 Towing & Recovery,Support Activities for Road Transportation,488410.0,220710072002.0
224-222@8dy-qtz-t5f,Loft 523,Traveler Accommodation,721110.0,220710134003.0
224-222@8dy-qv3-fs5,Red Truck Clubhouse,Restaurants and Other Eating Places,722511.0,220710135004.0
224-222@8dy-rbc-qzz,DAT Cajun Seafood,Specialty Food Stores,445220.0,220710006031.0
225-222@8dy-rfh-zvf,Evangelistic Baptist Church Inc,Religious Organizations,813110.0,220710102005.0
225-224@8dy-r9f-k75,Roly Poly Sandwiches,Restaurants and Other Eating Places,722511.0,220710114001.0
225-22b@8dy-qv8-v4v,Willie Mae's At The Market,Restaurants and Other Eating Places,722511.0,220710134003.0
226-222@8dy-qtz-rtv,Urban Outfitters,Clothing Stores,448140.0,220710135001.0
226-222@8dy-qv2-vmk,Cajun King,Restaurants and Other Eating Places,722511.0,220710036003.0
227-223@8dy-qv6-bkz,Tasty Treat,Special Food Services,722320.0,220710027001.0
228-222@8dy-qv3-5mk,Total Body Chiropractic,Offices of Other Health Practitioners,621310.0,220710060001.0
228-222@8dy-rf8-7bk,School Performance Consultants,Other Schools and Instruction,611691.0,220510249002.0
22b-222@8dy-r9h-t7q,Christ Church Cathedral Columbarium Cemetery,Death Care Services,812220.0,220710091002.0
22d-222@8dy-qv9-33q,St John Institutional Missionary Baptist Church,Religious Organizations,813110.0,220710086002.0
22f-222@8dy-qv2-mc5,Del Cid's Fuel Injection Service,Automotive Repair and Maintenance,8111.0,220710040001.0
22f-222@8dy-qv8-cnq,Kipp Central City Academy,Elementary and Secondary Schools,611110.0,220710140004.0
22j-222@8dy-rfb-m8v,The Wacked Out Weiner New Orleans,Restaurants and Other Eating Places,722513.0,220710072002.0
22j-223@8dy-qtz-tjv,Voodoo Two,Drinking Places (Alcoholic Beverages),722410.0,220710134003.0
22r-222@8dy-qtz-2zf,Bateau Restaurant & Bar,Restaurants and Other Eating Places,722511.0,220710135003.0
22r-222@8dy-qvh-9mk,New Orleans Lash Extensions,Personal Care Services,81211.0,220710076061.0
22t-222@8dy-qv6-dy9,The Elektra Sparkle Studio,"Sporting Goods, Hobby, and Musical Instrument Stores",451130.0,220710019002.0
22y-222@8dy-qv7-s5z,NOLA Critter Sitters,Other Personal Services,812910.0,220710141001.0
zzw-222@8dy-qt5-j7q,Jamie's Disposal,Waste Management and Remediation Services,562.0,220710017511.0
zzw-222@8dy-qtv-zpv,Walker's Southern Style Barbecue,Restaurants and Other Eating Places,722511.0,220710017373.0
zzw-222@8dy-qv7-28v,Dijon,Restaurants and Other Eating Places,722511.0,220710077002.0
zzw-222@8dy-rfc-c3q,The Family Doctors Oakwood Clinic,Offices of Physicians,621111.0,220510248002.0
zzw-226@8dy-r9j-8d9,Mignon,Clothing Stores,4481.0,220710090001.0
zzw-227@8dy-rbc-eyv,Macarthur Center,Lessors of Real Estate,531120.0,220710006042.0
zzw-22b@8dy-qtz-tqf,Nola Nica New Orleans,Restaurants and Other Eating Places,722511.0,220710134003.0
zzy-222@8dy-qvp-rhq,Live Confident Karate Lakeview,Other Schools and Instruction,611620.0,220710056013.0
zzy-223@8dy-rfj-rx5,Valence Street Cemetery,Death Care Services,812220.0,220710109002.0
zzy-225@8dy-qsk-j9z,Fuuditude,Restaurants and Other Eating Places,722511.0,220710033082.0
222-223@8dy-r9h-kfz,The Balcony Kitchen,Restaurants and Other Eating Places,722511.0,220710090003.0
222-223@8dy-rb7-m6k,Cricket Wireless,Wired and Wireless Telecommunications Carriers,517312.0,220710006132.0
223-222@8dy-qv3-yy9,Family Dollar Stores,"General Merchandise Stores, including Warehouse Clubs and Supercenters",452319.0,220710013013.0
223-223@8dy-qv6-vxq,Beauty Deep MedSpa,Personal Care Services,812199.0,220710077002.0
224-222@8dy-qsy-3wk,Krewe of Kids Pediatrics,Offices of Physicians,621111.0,220710133021.0
225-222@8dy-qv6-35z,Beauty Plus,Health and Personal Care Stores,446120.0,220710019003.0
225-222@8dy-r9j-7yv,Discount Zone,Gasoline Stations,447110.0,220710090002.0
225-223@8dy-qtz-qfz,Flambeaux Smokehouse & BBQ,Restaurants and Other Eating Places,722511.0,220710135001.0
227-222@8dy-qtz-sdv,Vieux Carre' Wine & Spirits,"Beer, Wine, and Liquor Stores",445310.0,220710135003.0
227-222@8dy-qvq-4vz,New Orleans Original Daiquiris,Drinking Places (Alcoholic Beverages),722410.0,220510223021.0
22d-222@8dy-rf7-c3q,Mat & Naddie's Restaurant,Restaurants and Other Eating Places,722511.0,220710129002.0
22d-224@8dy-qv2-k9f,Krispy Krunchy Chicken,Restaurants and Other Eating Places,722513.0,220710045001.0
22f-222@8dy-qtz-ty9,The Good Shepherd Nativity Mission School,Elementary and Secondary Schools,611110.0,220710134003.0
22f-222@8dy-qv9-bc5,Corinthian Baptist Church,Religious Organizations,813110.0,220710086002.0
22h-222@8dy-qtz-sbk,Dauphine Orleans Hotel,Traveler Accommodation,721110.0,220710135003.0
22h-222@8dy-r9f-249,Bywater Clothing,Clothing Stores,4481.0,220710144003.0
22k-222@8dy-qv2-y9z,St Peter's Presbyterian Church,Religious Organizations,813110.0,220710040001.0
22m-222@8dy-r9f-6ff,Costera,Restaurants and Other Eating Places,722511.0,220710107002.0
22q-222@8dy-r9f-9j9,The Bead Shop,"Office Supplies, Stationery, and Gift Stores",453220.0,220710144003.0
22r-222@8dy-qv6-dn5,Carle Photography,"Other Professional, Scientific, and Technical Services",54192.0,220710019002.0
22v-222@8dy-qv4-fpv,Eightwenty Pastries LLC,Restaurants and Other Eating Places,722515.0,220710136002.0
23k-222@8dy-qtz-4qf,Head To Toe,Clothing Stores,4481.0,220710135002.0
26h-222@8dy-qv8-p35,Vyoone's,Restaurants and Other Eating Places,722511.0,220710134001.0
zzw-222@8dy-qs9-ysq,Walmart Supercenter,"General Merchandise Stores, including Warehouse Clubs and Supercenters",452311.0,220710017022.0
zzw-222@8dy-qtp-mx5,Bullard Self Storage Center,Lessors of Real Estate,531130.0,220710017451.0
zzw-222@8dy-qv2-h5z,Eat Mah Taco Pal's Lounge,Drinking Places (Alcoholic Beverages),722410.0,220710045003.0
zzw-222@8dy-qvm-v4v,Adrian's Florist,Florists,453110.0,220710046002.0
zzw-222@8dy-r9h-w49,Brewstock Homebrewing Supplies,Electronics and Appliance Stores,443141.0,220710101002.0
zzw-222@8dy-r9j-bx5,Public Storage,Lessors of Real Estate,531130.0,220710142001.0
zzw-222@8dy-rb8-pd9,Save Your Car Auto Repair,Automotive Repair and Maintenance,8111.0,220510257001.0
zzw-222@8dy-rf8-5zz,Ochsner,Offices of Physicians,621111.0,220510249002.0
zzw-222@8dy-rf9-9xq,The Fertility Center At Ochsner,Specialty (except Psychiatric and Substance Abuse) Hospitals,622310.0,220510249001.0
zzw-222@8dy-rfb-3h5,Inland Seafood,Restaurants and Other Eating Places,722511.0,220710060001.0
zzw-222@8dy-rfh-kfz,Touro Imaging Center,Medical and Diagnostic Laboratories,6215.0,220710102005.0
zzw-223@8dy-qv8-mp9,The Transportation Revolution New Orleans TTRNO,Other Motor Vehicle Dealers,441228.0,220710134002.0
zzy-222@8dy-qvb-cqz,Federal City Inn & Suites,Traveler Accommodation,721110.0,220710006053.0
zzz-222@8dy-qtz-nt9,St MaryS Park,"Museums, Historical Sites, and Similar Institutions",712190.0,220710077001.0
zzz-222@8dy-qv4-rtv,Mickey Markey Playground,Other Amusement and Recreation Industries,713990.0,220710012001.0
222-222@8dy-qtv-hwk,Deanie's Restaurant & Bar,Restaurants and Other Eating Places,722511.0,220710017241.0
222-222@8dy-qv5-fxq,Carnival Club Casino New Orleans,Gambling Industries,713210.0,220710023003.0
222-222@8dy-qvn-nbk,Second Line Brewing,Beverage Manufacturing,312120.0,220710054001.0
222-222@8dy-r4j-835,Premier Chrysler Jeep Dodge Ram FIAT,Automobile Dealers,441110.0,220710017472.0
222-222@8dy-r4k-5fz,Stan's Truck Stop,Gasoline Stations,447110.0,220710017511.0
222-223@8dy-qtz-vj9,Le Meridien,Traveler Accommodation,721110.0,220710134001.0
222-223@8dy-rbc-y35,Starbucks,Restaurants and Other Eating Places,722515.0,220710006133.0
223-222@8dy-qv8-p35,Lucy's Retired Surfers Bar & Restaurant,Restaurants and Other Eating Places,722511.0,220710134001.0
223-223@8dy-qvg-bkz,Pizza Hut,Restaurants and Other Eating Places,722513.0,220710076061.0
224-222@8dy-qts-9fz,Praise Healing & Deliverence Ministry,Religious Organizations,813110.0,220710017361.0
224-222@8dy-qtz-syv,La Quinta Inns & Suites,Traveler Accommodation,721110.0,220710134003.0
225-222@8dy-qvn-hyv,GinaWare Costumes and Clothing,Clothing Stores,4481.0,220710054002.0
226-222@8dy-qtv-t7q,Church Of The Living God Inc,Religious Organizations,813110.0,220710017391.0
227-222@8dy-qvm-q75,New Orleans Photo Booth Company,Consumer Goods Rental,532289.0,220710046001.0
227-222@8dy-qw4-tjv,Doescher Earl J,Florists,453110.0,220870303002.0
228-222@8dy-rf7-649,Crane Rehab Center,Offices of Other Health Practitioners,621340.0,220710072001.0
229-222@8dy-rf6-p35,Bourree,Restaurants and Other Eating Places,722511.0,220710130003.0
22c-222@8dy-qv2-bff,The Treme Hotel,Traveler Accommodation,721110.0,220710040002.0
22c-222@8dy-rff-4n5,Redd's Uptilly Tavern,Drinking Places (Alcoholic Beverages),722410.0,220710126002.0
22d-222@8dy-r9f-89z,Tito's Ceviche & Pisco,Restaurants and Other Eating Places,722511.0,220710108002.0
22d-223@8dy-r9h-m6k,Leffler Heidi Bcsw Msw,Offices of Physicians,621111.0,220710099001.0
22f-222@8dy-rbj-q75,Booties And Bobbie Socks Day Care And Pre K,Child Day Care Services,624410.0,220750502001.0
22g-222@8dy-rf7-fs5,Sally Beauty Supply,Health and Personal Care Stores,446120.0,220710129001.0
22j-222@8dy-qty-yqf,Place d'Armes Hotel,Traveler Accommodation,721110.0,220710135002.0
22p-222@8dy-rf7-dsq,Title Stream,"Agencies, Brokerages, and Other Insurance Related Activities",524210.0,220710126001.0
23k-222@8dy-qty-yqf,Craig Tracy Fine Art Bodypainting Gallery,Other Miscellaneous Store Retailers,453920.0,220710135002.0
zzw-222@8dy-qv8-v75,New Orleans Public Library,Other Information Services,519120.0,220710134003.0
zzw-222@8dy-r9h-tqf,St Mark Missionary Baptist Church,Religious Organizations,813110.0,220710092003.0
zzw-222@8f5-27b-7t9,Pontchartrain Bluecrab Inc,Other Miscellaneous Manufacturing,3399.0,221030408035.0
zzw-223@8dy-r9j-n3q,Nirvana Weddings,Other Personal Services,812990.0,220710097001.0
zzw-224@8dy-qs9-zj9,Anna's Linens,Home Furnishings Stores,4422.0,220710137001.0
zzw-227@8dy-qtz-s89,,,,220710135001.0
zzw-22d@8dy-qv3-hkf,Davis William Eugene Dr,General Medical and Surgical Hospitals,622110.0,220710134003.0
zzy-223@8dy-qsg-75z,Genesis Church Of God In Christ,Religious Organizations,813110.0,220710017242.0
222-222@8dy-qv3-68v,Fuel Depot,Gasoline Stations,447110.0,220710134002.0
222-222@8dy-qv4-j9z,Folk Art Zone & Blues Museum,"Museums, Historical Sites, and Similar Institutions",712110.0,220710004001.0
222-224@8dy-qvn-qs5,The Mystere Mansion,Other Amusement and Recreation Industries,713990.0,220710065001.0
223-222@8dy-qv3-68v,DBLBLK Cafe,Restaurants and Other Eating Places,722515.0,220710134002.0
223-222@8dy-qvh-wrk,Starr AutoCare Center,Automotive Repair and Maintenance,8111.0,220710033011.0
223-222@8dy-r9j-59f,Sully Mansion Bed & Breakfast,Traveler Accommodation,721110.0,220710090001.0
223-222@8dy-rb7-k2k,Double M Feed Garden & Pet Supply,Other Miscellaneous Store Retailers,453910.0,220510250011.0
223-223@8dy-rbc-g6k,Chuck E. Cheese's,Restaurants and Other Eating Places,722513.0,220710006133.0
224-222@8dy-qtz-tjv,Hibernia Bank,Depository Credit Intermediation,522110.0,220710134003.0
224-222@8dy-qv4-sbk,Euclid Records,Electronics and Appliance Stores,443142.0,220710012001.0
224-222@8dy-qvj-gff,Third District Police Station,"Justice, Public Order, and Safety Activities",922120.0,220710033022.0
224-222@8dy-rf7-bzf,St Joan of Arc Church,Religious Organizations,813110.0,220710129001.0
225-222@8dy-qtz-qpv,Rubensteins,Clothing Stores,4481.0,220710134003.0
225-222@8dy-qvq-q2k,Asia Baptist Church,Religious Organizations,813110.0,220710138002.0
225-222@8dy-r4g-28v,Sarah Towles Reed Senior High School,Elementary and Secondary Schools,611110.0,220710017411.0
226-222@8dy-qtr-z75,Smoothie King,Restaurants and Other Eating Places,722515.0,220710017254.0
226-222@8dy-qv6-yqf,Green House Inn,Traveler Accommodation,721110.0,220710077002.0
22b-222@8dy-r9d-kmk,Love Swimming,Other Schools and Instruction,611620.0,220710144001.0
22b-225@8dy-qtz-k2k,Renaissance Hotels,Traveler Accommodation,721110.0,220710134001.0
22c-222@8dy-qvb-r49,Mothe Funeral Homes Inc,Death Care Services,812210.0,220710003001.0
22f-222@8dy-r9j-bx5,Rock Bottom Lounge,Drinking Places (Alcoholic Beverages),722410.0,220710097002.0
22h-222@8dy-qv2-dy9,Baby's Snack Box,Restaurants and Other Eating Places,722515.0,220710044013.0
22m-222@8dy-qtz-3t9,Johnny White's Bar,Drinking Places (Alcoholic Beverages),722410.0,220710135002.0
22n-222@8dy-qvb-5vf,Willing Workers Baptist Church Inc,Religious Organizations,813110.0,220710006041.0
22n-224@8dy-r9j-kfz,New Orleans Craniofacial,Offices of Physicians,621111.0,220710099001.0
22p-222@8dy-qtz-rp9,Evangeline,Restaurants and Other Eating Places,722511.0,220710135001.0
22t-224@8dy-r9j-nh5,La Riviere Confiserie,Specialty Food Stores,445292.0,220710099001.0
22v-222@8dy-qtz-6ff,Old Point Bar,Drinking Places (Alcoholic Beverages),722410.0,220710001001.0
22w-222@8dy-rfc-8gk,Nor Joe Imports,Grocery Stores,445110.0,220510224002.0
232-222@8dy-qv4-3qz,Naughty Hippie,Clothing Stores,4481.0,220710012001.0
234-222@8dy-rff-5xq,Neon Heart,Clothing Stores,4481.0,220710126002.0
24m-222@8dy-qtz-tsq,Brother's Food Mart,Gasoline Stations,447110.0,220710134003.0
zzw-222@8dy-qsd-bx5,Gaza Missionary Baptist Church,Religious Organizations,813110.0,220710017225.0
zzw-222@8dy-qv2-hqz,Tastebud Food Tours,Other Amusement and Recreation Industries,713990.0,220710037025.0
zzw-222@8dy-qv7-2p9,St Michael Special School,Elementary and Secondary Schools,611110.0,220710077002.0
zzw-222@8dy-qv7-qj9,Trinity Counseling & Training Center,Offices of Other Health Practitioners,621330.0,220710082002.0
zzw-222@8dy-qv8-fcq,Ace Vending Solutions,"Office Supplies, Stationery, and Gift Stores",453210.0,220710060001.0
zzw-222@8dy-qvn-fzz,Vision Center of the South,Offices of Other Health Practitioners,621320.0,220710065002.0
zzw-222@8dy-rfx-z2k,YAYA's Pet Sitting Service,Other Personal Services,812910.0,220510224002.0
222-222@8dy-qts-nwk,Miller Mccoy Academy For Mathematics And Business,Elementary and Secondary Schools,611110.0,220710017352.0
222-222@8dy-qvp-fcq,Cookie Dough Bliss New Orleans,Restaurants and Other Eating Places,722515.0,220710076063.0
222-222@8dy-rbc-sdv,McDonald's,Restaurants and Other Eating Places,722513.0,220710006031.0
222-222@8dy-rbc-x5z,Gizelle P Richard DDS,Offices of Dentists,621210.0,220710006152.0
223-222@8dy-qsk-fj9,Central Mustang and Auto Repairs,Automotive Repair and Maintenance,8111.0,220710033082.0
223-222@8dy-qt7-75z,Best Price Thrift Store,Used Merchandise Stores,453310.0,220710017511.0
223-222@8dy-rf9-2hq,Safelite,Automotive Repair and Maintenance,811122.0,220510248003.0
223-223@8dy-rfb-k2k,Exxon Mobil,Gasoline Stations,447110.0,220710072002.0
224-222@8dy-qtz-rx5,The Escape Game New Orleans,Other Amusement and Recreation Industries,713990.0,220710135001.0
225-222@8dy-qv3-3yv,Cacamo's Auto Repair,Automotive Repair and Maintenance,8111.0,220710049002.0
227-222@8dy-rf9-r49,Canal Furniture,Furniture Stores,442110.0,220710071012.0
228-222@8dy-rff-4qf,Angelique Clothing,Clothing Stores,4481.0,220710126001.0
228-22d@8dy-qtz-mc5,Popcorn Bistro,Specialty Food Stores,445292.0,220710134001.0
22b-222@8dy-qvp-nt9,SaintsforSinners,Florists,453110.0,220710056043.0
22c-222@8dy-qsk-j9z,Riteway Soul Food,Restaurants and Other Eating Places,722511.0,220710033082.0
22c-222@8dy-qvf-pqf,Inshore Rip Charters,Scenic and Sightseeing Transportation,487.0,220710056023.0
22h-222@8dy-r9f-5cq,Paris Parker Salon & Spa,Personal Care Services,81211.0,220710107002.0
22k-222@8dy-qtz-s89,Beer Fest,Drinking Places (Alcoholic Beverages),722410.0,220710135003.0
22q-222@8dy-qtz-94v,Tout De Suite Cafe,Restaurants and Other Eating Places,722515.0,220710001003.0
22q-222@8dy-r9j-kzz,Feet First,"Jewelry, Luggage, and Leather Goods Stores",448310.0,220710097001.0
23w-222@8dy-qtz-sqz,The Ground Floor,Home Furnishings Stores,4422.0,220710135001.0
zzw-222@8dy-qt6-wrk,Lincoln Cemetery Lot Sales Agency,Death Care Services,8122.0,220710017511.0
zzw-222@8dy-qvn-hdv,Ikura Hibachi and Sushi,Restaurants and Other Eating Places,722511.0,220710050001.0
zzw-222@8dy-qvn-pjv,PJ's Coffee,Restaurants and Other Eating Places,722515.0,220710055002.0
zzw-222@8dy-r9h-vfz,Hampton,Traveler Accommodation,721110.0,220710099001.0
zzw-222@8dy-rfj-9vf,Arc Of Greater New Orleans Early Intervention Program,Child Day Care Services,624410.0,220710117001.0
zzw-223@8dy-qsx-qfz,Subway,Restaurants and Other Eating Places,722513.0,220710133021.0
zzw-223@8dy-qv9-g6k,Avenue Cafe,Restaurants and Other Eating Places,722515.0,220710084001.0
zzw-223@8dy-r9j-6zf,Delta Mental Health of New Orleans,Offices of Other Health Practitioners,621330.0,220710082001.0
zzw-22b@8dy-rf8-8gk,Panda House,Restaurants and Other Eating Places,722511.0,220510248003.0
zzy-222@8dy-rfc-e9f,Junk's Above,"General Merchandise Stores, including Warehouse Clubs and Supercenters",452319.0,220710065001.0
zzy-223@8dy-qsb-3h5,Shirley's Pet Grooming,Other Personal Services,812910.0,220710137004.0
zzy-224@8dy-rfj-rx5,Valient Cemetery,Death Care Services,812220.0,220710109002.0
222-222@8dy-qsc-zpv,Natal's Super Market,Grocery Stores,445110.0,220710017511.0
222-222@8dy-qw4-wp9,Decorative Designs,Florists,453110.0,220710006041.0
222-222@8dy-rf9-6c5,,,,220510249002.0
222-222@8dy-rfd-ysq,Loyola University New Orleans,"Colleges, Universities, and Professional Schools",611310.0,220710121022.0
222-222@8dy-rj8-m49,Enterprise Rent-A-Car,Automotive Equipment Rental and Leasing,532111.0,220870302045.0
222-224@8dy-qsb-3kf,Metro by T Mobile Authorized Dealer,Electronics and Appliance Stores,443142.0,220710137004.0
223-222@8dy-rfh-yd9,Ora Vista Baptist Church,Religious Organizations,813110.0,220710103002.0
224-222@8dy-qv8-rrk,Ochsner Urgent Care Warehouse District,Outpatient Care Centers,621493.0,220710077001.0
224-222@8dy-qvn-7kf,Splish Splash Washateria,Drycleaning and Laundry Services,812320.0,220710037026.0
225-222@8dy-qtz-cwk,Louisiana Music Factory,Electronics and Appliance Stores,443142.0,220710026002.0
225-227@8dy-rf9-y35,Los Catrachos,Restaurants and Other Eating Places,722511.0,220710071011.0
226-222@8dy-qvg-bkz,Two Tony's Restaurant,Restaurants and Other Eating Places,722511.0,220710076061.0
226-224@8dy-qvr-mtv,Campus Federal Credit Union,Depository Credit Intermediation,522130.0,220710037012.0
229-222@8dy-qvp-vmk,Lakeview Vision Source,Offices of Other Health Practitioners,621320.0,220710056033.0
22b-222@8dy-qtz-ckf,13 Monaghan,Restaurants and Other Eating Places,722511.0,220710026002.0
22b-222@8dy-rf8-nh5,NOLA Thermography,Medical and Diagnostic Laboratories,6215.0,220510248003.0
22d-222@8dy-qtz-cwk,Balcony Music Club,Drinking Places (Alcoholic Beverages),722410.0,220710038002.0
22d-223@8dy-r9f-6ff,The Flying Pig Cafe,Restaurants and Other Eating Places,722511.0,220710107002.0
22g-222@8dy-qvn-ks5,Prosthetic Solutions,Health and Personal Care Stores,446199.0,220710050001.0
22g-222@8dy-rf7-f2k,Louisiana Pizza Kitchen Uptown,Restaurants and Other Eating Places,722511.0,220710126003.0
22k-222@8dy-rfb-m8v,Da Seafood Connect,Restaurants and Other Eating Places,722511.0,220710072002.0
22z-222@8dy-qv3-3t9,Mid City PoBoys,Restaurants and Other Eating Places,722511.0,220710049002.0
232-222@8dy-qtz-3bk,New Orleans Pharmacy Museum,"Museums, Historical Sites, and Similar Institutions",712110.0,220710135003.0
232-224@8dy-qtz-v2k,Motto by Hilton,Traveler Accommodation,721110.0,220710134003.0
236-222@8dy-r9j-8y9,Molly's Rise and Shine,Restaurants and Other Eating Places,722511.0,220710083001.0
23w-222@8dy-qtz-4d9,Big Easy Petshop and Rescue,Other Miscellaneous Store Retailers,453910.0,220710135002.0
zzw-222@8dy-qv8-w8v,Louisiana Lithotripter,"Colleges, Universities, and Professional Schools",611310.0,220710134002.0
zzw-222@8dy-qvn-ygk,Easton Park Playground,Other Amusement and Recreation Industries,713990.0,220710045003.0
zzw-222@8dy-r4k-tjv,Watermill Express,Specialty Food Stores,445299.0,220710017502.0
zzw-222@8dy-r9f-k9f,Toast,Restaurants and Other Eating Places,722511.0,220710114001.0
zzw-222@8dy-rf7-fs5,The Camellia Grill,Restaurants and Other Eating Places,722511.0,220710129001.0
zzw-223@8dy-qv8-xkf,Mercedes Benz Superdome,"Promoters of Performing Arts, Sports, and Similar Events",711310.0,220710134002.0
zzw-224@8dy-qv2-h5z,Gattone Grasso,Restaurants and Other Eating Places,722511.0,220710045003.0
zzw-224@8dy-rf7-fs5,O'Henry's Food & Spirits,Restaurants and Other Eating Places,722511.0,220710129001.0
zzw-225@8dy-qv3-j9z,St Jude Shrine,Religious Organizations,813110.0,220710135001.0
zzy-222@8dy-qv8-qzz,Howard Ave Park and Ride,Other Personal Services,812930.0,220710134002.0
zzy-222@8dy-qvm-rzf,City Park Peristyle Pavilion,"Museums, Historical Sites, and Similar Institutions",712190.0,220719800001.0
zzy-222@8dy-rfh-yjv,University Retail Center,Lessors of Real Estate,531120.0,220710094004.0
222-222@8dy-qt6-zvf,Sci Academy,Elementary and Secondary Schools,611110.0,220710017362.0
222-222@8dy-qtz-33q,Rouses Markets,Grocery Stores,445110.0,220710135002.0
222-222@8dy-qv9-vfz,Fischer Community Church,Religious Organizations,813110.0,220710006011.0
222-222@8dy-qvb-brk,Brother's Food Mart,Gasoline Stations,447110.0,220710006053.0
222-222@8dy-qvn-nwk,Greenwood Funeral Home,Death Care Services,8122.0,220710055002.0
222-222@8dy-r4h-26k,Michoud Farmers Market,Specialty Food Stores,445210.0,220710017511.0
222-222@8dy-rb7-kcq,Lamb Of God Christian Ministry,Religious Organizations,813110.0,220510250011.0
222-222@8f5-276-9cq,Gulf Coast Bank & Mortgage Lending,Activities Related to Credit Intermediation,522310.0,221030408035.0
223-222@8dy-qv6-grk,,,,220710012003.0
223-222@8dy-qv9-3nq,Greater Macedonia Baptist Church,Religious Organizations,813110.0,220710092002.0
223-222@8dy-r9f-jgk,Clancy's Restaurant,Restaurants and Other Eating Places,722511.0,220710115002.0
223-222@8dy-r9h-v2k,Capital One,Depository Credit Intermediation,522110.0,220710099001.0
223-222@8dy-rb8-qs5,Bahais Of Gretna,Religious Organizations,813110.0,220510257001.0
223-222@8dy-rf8-c3q,CrossFit,Other Amusement and Recreation Industries,713940.0,220510248003.0
224-222@8dy-qtz-j9z,Francesca's,Clothing Stores,448120.0,220710134001.0
