placekey,location_name,top_category,naics_code,poi_cbg
22b-222@8dy-qtw-gp9,Hi Tech Security,Electronics and Appliance Stores,443142.0,220710017391.0
22b-222@8dy-rfc-btv,Sofas & Chairs,Furniture Stores,442110.0,220510248001.0
22f-222@8dy-qv8-c89,New St Mark Baptist Church,Religious Organizations,813110.0,220710140003.0
22j-222@8dy-qv6-d5f,Poke chan,Restaurants and Other Eating Places,722511.0,220710015002.0
22j-223@8dy-qv2-pqf,Mcdonogh 35 Academy,Elementary and Secondary Schools,611110.0,220710034002.0
22m-222@8dy-qv5-d35,Pelican Bay,Restaurants and Other Eating Places,722511.0,220710020003.0
22s-222@8dy-r9d-vj9,The Dark Lady of New Orleans,Other Personal Services,812990.0,220710116002.0
22t-223@8dy-qtz-qcq,Walgreens,Health and Personal Care Stores,446110.0,220710134003.0
22x-222@8dy-qv6-f2k,Conrad's Shop,Used Merchandise Stores,453310.0,220710018001.0
235-222@8dy-r9h-pn5,Drink Beauty,Restaurants and Other Eating Places,722515.0,220710096001.0
237-223@8dy-qtz-ckf,Frenchmen Street Orleans,Traveler Accommodation,721110.0,220710026002.0
26j-222@8dy-qv8-p35,Gianna Restaurant,Restaurants and Other Eating Places,722511.0,220710134001.0
zzw-222@8dy-qsb-3bk,Family Dollar Stores,"General Merchandise Stores, including Warehouse Clubs and Supercenters",452319.0,220710137004.0
zzw-222@8dy-qvv-qj9,Barrios Real Estate Group,Offices of Real Estate Agents and Brokers,531210.0,220870304002.0
zzw-222@8dy-rfb-snq,La Vie En Rose Cafe,Restaurants and Other Eating Places,722515.0,220710094001.0
zzw-223@8dy-qsk-f75,Reggie's Flowers & Gifts,Florists,453110.0,220710033082.0
zzw-223@8dy-qvp-w49,New Orleans Childrens Dental Center,Offices of Dentists,621210.0,220710056031.0
zzw-223@8dy-rfj-p9z,Crescent City Soccer,Other Amusement and Recreation Industries,713940.0,220710109001.0
zzw-224@8dy-qv8-nbk,Q Smokery & Cafe,Restaurants and Other Eating Places,722511.0,220710134002.0
zzw-225@8dy-qtz-kzz,The Outlet Collection At Riverwalk,Lessors of Real Estate,531120.0,220710134001.0
zzw-225@8dy-qtz-vpv,Harrah's New Orleans Casino & Hotel,Gambling Industries,713210.0,220710134001.0
zzy-222@8dy-rfd-kfz,George Washington Carver Playground Park,"Museums, Historical Sites, and Similar Institutions",712190.0,220710125002.0
zzz-222@8dy-qv8-9mk,Union Passenger Terminal Plaza,"Museums, Historical Sites, and Similar Institutions",712190.0,220710134002.0
zzz-222@8dy-r9h-wc5,Mcdonogh Zachery Park,"Museums, Historical Sites, and Similar Institutions",712190.0,220710090003.0
222-222@8dy-qts-xbk,Fidelity Homestead Association,Depository Credit Intermediation,522110.0,220710017351.0
222-222@8dy-qts-ygk,Walgreens,Health and Personal Care Stores,446110.0,220710017351.0
222-222@8dy-qv8-gtv,Aqua Nola,Drinking Places (Alcoholic Beverages),722410.0,220710060001.0
222-222@8dy-qv9-dvz,Santa Fe Tapas,Restaurants and Other Eating Places,722511.0,220710139001.0
222-222@8dy-rbc-v2k,El Paso Mexican Grill,Restaurants and Other Eating Places,722511.0,220710006152.0
222-222@8dy-rbd-4n5,Paul Habans Charter School,Elementary and Secondary Schools,611110.0,220710006042.0
222-222@8dy-rky-8sq,CrossFit,Other Amusement and Recreation Industries,713940.0,220750502001.0
222-223@8dy-qts-y5f,Wagner's Meat Market,Grocery Stores,445110.0,220710017361.0
222-223@8dy-qvh-975,Smoke House Grill,Restaurants and Other Eating Places,722511.0,220510201011.0
222-223@8dy-rfb-mff,Marist Fathers Notre Dame Seminary,Religious Organizations,813110.0,220710128001.0
222-223@8dy-rff-8d9,The Drawing Board Cafe,Restaurants and Other Eating Places,722513.0,220710121022.0
223-222@8dy-qvk-zs5,St Pius X School,Elementary and Secondary Schools,611110.0,220710133012.0
223-222@8dy-r4j-4sq,Barcode Apparel,Clothing Stores,4481.0,220710017472.0
223-222@8dy-rbc-py9,Louisiana Research Associates,Offices of Other Health Practitioners,621330.0,220710006043.0
223-223@8dy-qvp-fj9,Pizza Nola,Restaurants and Other Eating Places,722511.0,220710076063.0
224-222@8dy-qsk-c89,Sammy's Food Service & Deli,Restaurants and Other Eating Places,722511.0,220710023005.0
224-222@8dy-qtw-vmk,Lush & Company,Personal Care Services,81211.0,220710017441.0
225-222@8dy-qv3-789,Durand Tuxedo Consultants,Clothing Stores,4481.0,220710050002.0
225-222@8dy-qvj-92k,Our Lady of Lavang Mission,Religious Organizations,813110.0,220710033031.0
226-222@8dy-qtw-pqf,New Orleans East Wellness Center,Offices of Physicians,621111.0,220710017362.0
226-222@8dy-qv5-rc5,Metro by T Mobile Authorized Dealer,Electronics and Appliance Stores,443142.0,220710015001.0
228-222@8dy-qvn-qvf,Vapor Room,Other Miscellaneous Store Retailers,453991.0,220710054001.0
228-222@8dy-rbc-ebk,Algiers Pharmacy,Health and Personal Care Stores,446110.0,220710006042.0
229-223@8dy-qv9-cyv,Evangeline II,Drinking Places (Alcoholic Beverages),722410.0,220710139002.0
22c-222@8dy-r9j-kfz,Unity of New Orleans Spiritual Center,Religious Organizations,813110.0,220710099001.0
22g-222@8dy-rff-4qf,Fresco Cafe and Pizzeria,Restaurants and Other Eating Places,722511.0,220710126002.0
22k-222@8dy-qvn-h89,El Rinconcito,Restaurants and Other Eating Places,722511.0,220710050001.0
234-222@8dy-rf6-kxq,Glam Divas Dance Company,Other Amusement and Recreation Industries,713940.0,220710130001.0
238-222@8dy-qty-zvf,The Italian Barrel,Restaurants and Other Eating Places,722511.0,220710038002.0
zzw-222@8dy-qtz-mhq,Cafe Du Monde,Restaurants and Other Eating Places,722515.0,220710134001.0
zzw-222@8dy-qv9-cqz,Happy Raptor Distilling,Beverage Manufacturing,312140.0,220710139002.0
zzw-222@8dy-qv9-f75,AT&T,Wired and Wireless Telecommunications Carriers,517312.0,220710139002.0
zzw-222@8dy-rf9-6p9,Zaddie's Tavern,Drinking Places (Alcoholic Beverages),722410.0,220510249001.0
zzw-222@8dy-rfd-yy9,Loyola University New Orleans Bookstore,Book Stores and News Dealers,451211.0,220710121022.0
zzw-222@8dy-rjd-ch5,Frozen Fantasies Daiquiris,Drinking Places (Alcoholic Beverages),722410.0,220870302091.0
zzw-223@8dy-qv8-ndv,Triumph Motorcycles,Other Motor Vehicle Dealers,441228.0,220710134002.0
zzw-224@8dy-qv8-wkz,Fedex Office Print & Ship Center,Couriers and Express Delivery Services,492110.0,220710134002.0
zzy-222@8dy-rff-8d9,Tulane University,"Colleges, Universities, and Professional Schools",611310.0,220710121022.0
zzy-222@8dy-rfj-rx5,Girod Cemetery historical,Death Care Services,812220.0,220710109002.0
zzz-222@8dy-qsg-n89,Digby Playground,Other Amusement and Recreation Industries,713990.0,220710017202.0
zzz-222@8dy-qv8-btv,Martin Luther King Jr Walk,"Museums, Historical Sites, and Similar Institutions",712190.0,220710140001.0
222-222@8dy-qts-hnq,New Orleans East Assembly Of God,Religious Organizations,813110.0,220710017252.0
222-225@8dy-qvn-t5f,Crescent City Farmers Market Thursday Market,Specialty Food Stores,445210.0,220710054003.0
223-222@8dy-qv5-zpv,Smith Tire Services,Automotive Repair and Maintenance,8111.0,220710026001.0
223-222@8dy-qvr-w8v,Raphaelle's New Orleans Massage Therapy,Personal Care Services,812199.0,220710028002.0
225-223@8dy-qtz-t9z,Cafe 601,Restaurants and Other Eating Places,722511.0,220710134003.0
226-222@8dy-qv8-d35,Greater Mt Rose Baptist Church,Religious Organizations,813110.0,220710140002.0
228-222@8dy-qtr-z75,Infinite Solutions for Mental Wellness,Offices of Other Health Practitioners,621330.0,220710017254.0
228-222@8dy-qvn-h89,SWEGS Kitchen Mid City,Restaurants and Other Eating Places,722511.0,220710054003.0
229-223@8dy-qtz-qxq,The Ritz-Carlton,Traveler Accommodation,721110.0,220710134003.0
229-223@8dy-r4j-4sq,Blaze Bistro 504,Restaurants and Other Eating Places,722511.0,220710017472.0
22b-222@8dy-qv2-vmk,Southern Rep Theatre,"Promoters of Performing Arts, Sports, and Similar Events",711310.0,220710036003.0
22b-222@8dy-qv9-835,First Evangelist Baptist Church,Religious Organizations,813110.0,220710086001.0
22c-222@8dy-rfj-5s5,South Broad Community Health Center,Offices of Physicians,621111.0,220710103001.0
22d-222@8dy-qv6-xnq,Bakery Bar,Restaurants and Other Eating Places,722511.0,220710077002.0
22f-222@8dy-qv9-3dv,Mount Ararat Missionary Baptist Church,Religious Organizations,813110.0,220710086002.0
22g-222@8dy-qvn-fmk,Louisiana Running Walking Co,Shoe Stores,448210.0,220710054003.0
22j-222@8dy-qv6-7h5,Greater Emmanuel Missionary Baptist Church,Religious Organizations,813110.0,220710029002.0
22m-222@8dy-qtz-33q,Arcadian Books & Art Prints,Book Stores and News Dealers,451211.0,220710135002.0
22p-222@8dy-qtz-5xq,Trinity Lutheran Church,Religious Organizations,813110.0,220710001002.0
22p-222@8dy-qv2-975,Mount Zion Baptist Church,Religious Organizations,813110.0,220710044012.0
22t-222@8dy-qvm-sqz,Mid City Reiki & Your Complete Life Coach,Offices of Other Health Practitioners,621330.0,220710046003.0
234-222@8dy-qtz-sbk,Bayona,Restaurants and Other Eating Places,722511.0,220710135003.0
243-222@8dy-r9h-wff,New Orleans Speech & Hearing Center,Medical and Diagnostic Laboratories,6215.0,220710100003.0
zzw-222@8dy-qv9-dd9,New Orleans Fire Department District 2 Engine 16,"Justice, Public Order, and Safety Activities",922160.0,220710140003.0
zzw-222@8dy-qw2-xbk,Family Dollar Stores,"General Merchandise Stores, including Warehouse Clubs and Supercenters",452319.0,220710006061.0
zzw-222@8dy-rf9-6c5,New Orleans Original Daquiris,Restaurants and Other Eating Places,722511.0,220510249002.0
zzw-222@8dy-rfh-r8v,Pyramids Cafe,Restaurants and Other Eating Places,722511.0,220710122001.0
zzw-222@8dy-rgz-x89,Audubon Tennis Courts,Amusement Parks and Arcades,713110.0,220710144001.0
zzw-223@8dy-rbc-vj9,Algiers Plaza,Lessors of Real Estate,531120.0,220710006152.0
zzw-226@8dy-qtz-s89,Royal Sonesta New Orleans,Traveler Accommodation,721110.0,220710135001.0
zzw-22d@8dy-qtz-mhq,Skechers,Shoe Stores,448210.0,220710134001.0
zzw-22j@8dy-qtz-v2k,Smoothie King,Restaurants and Other Eating Places,722515.0,220710134003.0
zzy-222@8dy-qtz-4d9,Joan of Arc Statue,Restaurants and Other Eating Places,722511.0,220710038002.0
zzy-225@8dy-qv8-xt9,Central Parking,Other Personal Services,812930.0,220710134003.0
222-222@8dy-qsk-6ff,Days Inn,Traveler Accommodation,721110.0,220710137004.0
222-222@8dy-qv9-cyv,Sherwin-Williams,Building Material and Supplies Dealers,444120.0,220710139002.0
223-222@8dy-qv6-fpv,Saint Germain,Restaurants and Other Eating Places,722511.0,220710012002.0
223-222@8dy-rfj-8sq,Greenie House,Elementary and Secondary Schools,611110.0,220710109003.0
226-222@8dy-r32-jd9,New Orleans Fire Department District 4 Engine 31,"Justice, Public Order, and Safety Activities",922160.0,220710017341.0
226-222@8dy-r9j-n3q,No Fleas Market,Used Merchandise Stores,453310.0,220710097001.0
227-222@8dy-rfd-sqz,Games Workshop,"Sporting Goods, Hobby, and Musical Instrument Stores",451120.0,220710129001.0
229-223@8dy-qvg-cdv,John Jay Beauty Schools,Technical and Trade Schools,6115.0,220710056011.0
22b-222@8dy-rf7-btv,Maple Leaf Bar,Drinking Places (Alcoholic Beverages),722410.0,220710129001.0
22c-222@8dy-rfh-kj9,Wise John M Dr Phys,Offices of Physicians,621111.0,220710111001.0
22f-222@8dy-rfh-r8v,Roberts' Bar and Liquor Store,Drinking Places (Alcoholic Beverages),722410.0,220710122001.0
22g-223@8dy-rfh-jjv,Center For Ethical Living And Social Justice Renewal,Religious Organizations,813110.0,220710111003.0
22h-222@8dy-qv8-nyv,PJ's Coffee & Tea,Restaurants and Other Eating Places,722515.0,220710134002.0
22j-222@8dy-qv9-cnq,Krewe Du Brew,Restaurants and Other Eating Places,722515.0,220710139002.0
22j-222@8dy-qvn-fs5,Doson Noodle House,Restaurants and Other Eating Places,722511.0,220710054003.0
22m-222@8dy-qts-ffz,Car Repair On Wheels by Preston Sr,Automotive Repair and Maintenance,8111.0,220710017252.0
22r-222@8dy-qv7-q75,,,,220710082001.0
22s-222@8dy-qty-zpv,Wicked Orleans,Clothing Stores,4481.0,220710038002.0
zzw-222@8dy-qtb-2zf,Cornerstone United Methodist Church,Religious Organizations,813110.0,220710017471.0
zzw-222@8dy-r4h-kvf,BAYOU NISSAN,Automobile Dealers,441110.0,220710017472.0
zzw-222@8dy-r9d-zmk,Continental Equipment,"Machinery, Equipment, and Supplies Merchant Wholesalers",4238.0,220710142001.0
zzw-222@8dy-rfd-k75,Mt Moriah Missionary Baptist Church,Religious Organizations,813110.0,220710125002.0
zzw-222@8dy-rfh-nt9,Ashtanga Yoga Room,Other Amusement and Recreation Industries,713940.0,220710111001.0
zzw-222@8dy-rfh-yn5,Chief Mobile,Electronic and Precision Equipment Repair and Maintenance,811211.0,220710102001.0
zzw-223@8dy-qtz-vcq,Premium Parking P403,Other Personal Services,812930.0,220710135001.0
zzw-224@8dy-rbc-kzz,Papa John's,Restaurants and Other Eating Places,722513.0,220710006133.0
zzw-224@8dy-rbc-rrk,Triumph Krav Maga,Other Amusement and Recreation Industries,713940.0,220710006131.0
zzw-225@8dy-qv2-ht9,Subway,Restaurants and Other Eating Places,722513.0,220710041001.0
zzw-225@8dy-qvn-gx5,Mid City Market,Lessors of Real Estate,531120.0,220710054003.0
zzw-225@8dy-rbc-kzz,State Farm,"Agencies, Brokerages, and Other Insurance Related Activities",524210.0,220710006133.0
zzy-223@8dy-qv8-hbk,OB GYN Clinic,Outpatient Care Centers,6214.0,220710060001.0
zzz-222@8dy-qvb-q75,Mardi Gras Blvd Trail,"Museums, Historical Sites, and Similar Institutions",712190.0,220710003002.0
222-222@8dy-qv8-hqz,Brown's Uniforms,Clothing Stores,4481.0,220710060001.0
222-222@8dy-rbc-g6k,Boost Mobile,Wired and Wireless Telecommunications Carriers,517312.0,220710006133.0
222-222@8dy-rf8-qj9,Barto Appliance,Electronics and Appliance Stores,443141.0,220510248003.0
222-222@8dy-rm6-c5z,Gulf Contractors,Amusement Parks and Arcades,713110.0,220710006171.0
222-223@8dy-qt6-zvf,G W Carver Collegiate Academy,Elementary and Secondary Schools,611110.0,220710017362.0
222-223@8dy-qtz-435,Bistreaux,Restaurants and Other Eating Places,722511.0,220710135003.0
223-222@8dy-qsf-qxq,Hayne Supermarket,Gasoline Stations,447110.0,220710017244.0
223-222@8dy-qvr-6rk,Working Faith Ministries And Charities Inc,Religious Organizations,813110.0,220710023005.0
224-222@8dy-qvn-rrk,Pro Tech Collision and Automotive Center,Automotive Repair and Maintenance,8111.0,220710054001.0
224-222@8dy-rbc-yn5,Freddie's Chicken N' Waffles,Restaurants and Other Eating Places,722511.0,220710006151.0
225-222@8dy-rfc-h3q,Lilia Haller Ballet Classique,Other Amusement and Recreation Industries,713940.0,220710065001.0
227-222@8dy-qtz-s89,Huge Ass Beers,Drinking Places (Alcoholic Beverages),722410.0,220710135001.0
227-222@8dy-qv9-835,On Faith Donuts,Restaurants and Other Eating Places,722515.0,220710140003.0
228-222@8dy-r9h-rx5,Louisiana Discount Market,Gasoline Stations,447110.0,220710100003.0
229-222@8dy-qtz-3t9,Rinard Matt,Other Miscellaneous Store Retailers,453920.0,220710135002.0
229-222@8dy-qv9-cyv,The Beaded Oak,Drinking Places (Alcoholic Beverages),722410.0,220710139002.0
22b-223@8dy-qv6-yn5,,,,220710139001.0
22c-222@8dy-qv6-djv,Hancock and Whitney Bank,Depository Credit Intermediation,522110.0,220710019001.0
22d-222@8dy-rkx-fs5,Cocoa & Cream Mobile Foods and Catering,Restaurants and Other Eating Places,722511.0,220710006112.0
22j-222@8dy-qsj-j7q,Luxe Lashes Brows,Personal Care Services,81211.0,220710137004.0
22n-222@8dy-rfx-xh5,JB's Bar & Grill,Restaurants and Other Eating Places,722511.0,220510224002.0
22v-222@8dy-r9j-nh5,Fleur D'Orleans,"Jewelry, Luggage, and Leather Goods Stores",448310.0,220710099001.0
23b-222@8dy-r9j-kj9,Robert Menuet LCSW,Offices of Other Health Practitioners,621330.0,220710100003.0
zzw-222@8dy-qsx-tjv,Benjamin Franklin High School,Elementary and Secondary Schools,611110.0,220710133021.0
zzw-222@8dy-qv6-4vz,Blair House New Orleans,Traveler Accommodation,721110.0,220710026001.0
zzw-222@8dy-rf7-ct9,Second Free Mission Baptist Church,Religious Organizations,813110.0,220710127004.0
zzw-222@8dy-rfb-cwk,Pro T Landscaping,Lawn and Garden Equipment and Supplies Stores,4442.0,220710124001.0
zzw-222@8dy-rjd-qcq,Emilys Hair and Nail's,Personal Care Services,81211.0,220870302092.0
zzw-223@8dy-qv9-389,Mahalia Jackson Elementary School,Elementary and Secondary Schools,611110.0,220710086002.0
zzw-223@8dy-r9j-jvz,Townsend Treatment Center,Specialty (except Psychiatric and Substance Abuse) Hospitals,622310.0,220710099001.0
zzw-223@8dy-rfc-8sq,Art In Me A Center For Behavior,Offices of Other Health Practitioners,621330.0,220510248002.0
zzw-223@8dy-rfh-yjv,Citi Trends,Department Stores,452210.0,220710094004.0
zzw-22h@8dy-rfx-xbk,Naked Pizza,Restaurants and Other Eating Places,722511.0,220510224002.0
zzy-222@8dy-rfh-tsq,Yulman Stadium,Spectator Sports,711211.0,220710121012.0
222-222@8dy-rbc-j7q,New Orleans Original Daiquiris,Drinking Places (Alcoholic Beverages),722410.0,220710006133.0
222-224@8dy-rfb-mff,Notre Dame Seminary Of New Orleans,Religious Organizations,813110.0,220710128001.0
223-222@8dy-rfh-ygk,ULTA Beauty,Health and Personal Care Stores,446120.0,220710143002.0
223-224@8dy-r9f-kcq,Wendy's,Restaurants and Other Eating Places,722513.0,220710144001.0
224-222@8dy-qsk-3t9,Walmart Pharmacy,Health and Personal Care Stores,446110.0,220710017022.0
224-223@8dy-r9j-6zf,Krewe of Muses,Restaurants and Other Eating Places,722511.0,220710083001.0
225-222@8dy-qtz-nh5,Outlaw Pizza,Restaurants and Other Eating Places,722511.0,220710077001.0
225-222@8dy-r9h-sbk,Pilgrims Rest Baptist Church 2,Religious Organizations,813110.0,220710100001.0
225-222@8dy-rbc-enq,Take 5 Oil Change,Automotive Repair and Maintenance,811118.0,220710006133.0
226-222@8dy-rf9-8d9,Shades of Light,Home Furnishings Stores,4422.0,220510249001.0
228-222@8dy-qv9-7yv,Hollywood Nails & Spa VI,Personal Care Services,81211.0,220710086001.0
229-222@8dy-r9f-5cq,Osaka Kohai,Restaurants and Other Eating Places,722511.0,220710107002.0
22b-222@8dy-rfj-cwk,De La Salle High School,Elementary and Secondary Schools,611110.0,220710108001.0
22c-222@8dy-qtz-r6k,Mahony's Po Boys & Seafood,Restaurants and Other Eating Places,722511.0,220710135001.0
22c-222@8dy-r9j-nnq,Curtain Exchange Franchise Operating,"Sporting Goods, Hobby, and Musical Instrument Stores",451130.0,220710097001.0
22d-222@8dy-qv6-54v,Banana Courtyard,Traveler Accommodation,721110.0,220710026002.0
22f-222@8dy-qtp-9vf,City Of Love St Bernard,Religious Organizations,813110.0,220710017451.0
22f-222@8dy-rf9-yjv,Mr Everything Cafe,Restaurants and Other Eating Places,722515.0,220710060001.0
22q-222@8dy-r9f-k75,Thu's Tailor,Personal and Household Goods Repair and Maintenance,811490.0,220710106002.0
22v-222@8dy-rfd-jn5,Uptown Frames,Home Furnishings Stores,4422.0,220710120001.0
22y-222@8dy-qv6-hbk,The Franklin,Restaurants and Other Eating Places,722511.0,220710012003.0
22y-222@8dy-rff-52k,Flashmob New Orleans,Other Schools and Instruction,611630.0,220710126003.0
23b-222@8dy-r9d-wff,Avo,Restaurants and Other Eating Places,722511.0,220710114002.0
2cm-222@8dy-qv8-qj9,That's Amore Pizzeria Chicago Wood & Fire,Restaurants and Other Eating Places,722511.0,220710139001.0
zzw-222@8dy-qsb-2x5,,,,220710137001.0
zzw-222@8dy-qsd-2zf,Life In The Word Church,Religious Organizations,813110.0,220710017223.0
zzw-222@8dy-qv8-ndv,Rouses Markets,Grocery Stores,445110.0,220710134002.0
zzw-222@8dy-qvn-c89,Christian Brothers School,Elementary and Secondary Schools,611110.0,220719800001.0
zzw-222@8dy-qw4-wp9,General Meyer Pharmacy,Health and Personal Care Stores,446110.0,220710006041.0
zzw-222@8dy-rf9-skf,Waning Moon Weddings & Ceremonies,Other Personal Services,812990.0,220710071012.0
zzw-223@8dy-qs9-xyv,Crescent City Casino,Gambling Industries,713210.0,220710137001.0
zzw-223@8dy-qvp-rhq,El Gato Negro,Restaurants and Other Eating Places,722511.0,220710056031.0
zzw-223@8dy-rfc-pjv,Lake Lawn Metairie Funeral Home & Cemetery,Death Care Services,812210.0,220710076042.0
zzz-222@8dy-qsk-54v,Schabel Playspot,"Museums, Historical Sites, and Similar Institutions",712190.0,220710137004.0
222-222@8dy-qt6-fzz,Watermill Express,Specialty Food Stores,445299.0,220710017231.0
222-222@8dy-qv3-2c5,University Medical Center New Orleans,General Medical and Surgical Hospitals,622110.0,220710049003.0
222-222@8dy-qv8-g6k,United Refrigeration,"Hardware, and Plumbing and Heating Equipment and Supplies Merchant Wholesalers",423740.0,220710060001.0
222-222@8dy-rj8-kmk,Foster Corporation,"Sporting Goods, Hobby, and Musical Instrument Stores",451120.0,220870302045.0
222-226@8dy-r9j-rrk,NOLA Pizza Co,Restaurants and Other Eating Places,722511.0,220710142001.0
222-22b@8dy-qv8-vxq,Black F William PHD,General Medical and Surgical Hospitals,622110.0,220710134002.0
224-222@8dy-qv3-dy9,Rudy Smith Service,Automotive Repair and Maintenance,8111.0,220710049002.0
224-222@8dy-rfc-bc5,Metairie Academy For Advanced Studies,Elementary and Secondary Schools,611110.0,220510248001.0
225-223@8dy-qv3-g8v,Chef D'Z Cafe,Restaurants and Other Eating Places,722511.0,220710039002.0
226-222@8dy-qv9-g6k,Red Zone,Restaurants and Other Eating Places,722513.0,220710084001.0
226-222@8dy-rf8-d35,Celebration Church Metairie Campus,Religious Organizations,813110.0,220510248003.0
227-224@8dy-rf7-bc5,READ Nola,Other Amusement and Recreation Industries,713990.0,220710126001.0
228-222@8dy-qsc-3bk,Relationship Life Coaching Dynamics,Other Personal Services,812990.0,220710017011.0
22c-222@8dy-qtz-4qf,Tujague's Restaurant,Restaurants and Other Eating Places,722511.0,220710135002.0
22d-222@8dy-qtz-rc5,Bayou Gifts,Florists,453110.0,220710134003.0
22d-222@8dy-qv6-djv,Doily,Restaurants and Other Eating Places,722513.0,220710019001.0
22f-222@8dy-qv4-6tv,Reaping The Harvest Full Gospel Baptist Church,Religious Organizations,813110.0,220710008002.0
22g-222@8dy-qv2-xdv,Ashton's Bed and Breakfast,Traveler Accommodation,721110.0,220710035003.0
22g-222@8dy-r9h-z75,Restoration Embassy Church,Religious Organizations,813110.0,220710141002.0
22q-222@8dy-r9d-vmk,PJ's Coffee,Restaurants and Other Eating Places,722513.0,220710114001.0
23g-222@8dy-r9h-zzz,Virginia Allen LCSW,Offices of Other Health Practitioners,621330.0,220710088001.0
zzw-222@8dy-qt7-3bk,Resurrection Of Our Lord,Elementary and Secondary Schools,611110.0,220710017232.0
zzw-222@8dy-qt7-zmk,Entergy New Orleans Michoud Plant,"Electric Power Generation, Transmission and Distribution",221111.0,220710017511.0
zzw-222@8dy-qv6-fmk,U-Haul,Automotive Equipment Rental and Leasing,532120.0,220710012002.0
zzw-222@8dy-qv8-rx5,Memorial Hall Museum,"Museums, Historical Sites, and Similar Institutions",712110.0,220710134002.0
zzw-222@8dy-qvm-tn5,Toups Meatery,Restaurants and Other Eating Places,722511.0,220710046002.0
zzw-222@8dy-rfj-k2k,Holy Name Of Jesus,Elementary and Secondary Schools,611110.0,220710117004.0
222-222@8dy-qs9-zj9,Econo Lodge,Traveler Accommodation,721110.0,220710137001.0
222-222@8dy-qvn-nt9,Dollar Tree,"General Merchandise Stores, including Warehouse Clubs and Supercenters",452319.0,220710055002.0
222-222@8dy-r9j-jvz,Curahealth New Orleans,General Medical and Surgical Hospitals,622110.0,220710099001.0
222-222@8dy-rfb-kpv,O'Reilly Auto Parts,"Automotive Parts, Accessories, and Tire Stores",441310.0,220710072002.0
222-223@8dy-qv8-vfz,Holiday Inn,Traveler Accommodation,721110.0,220710134003.0
222-223@8dy-rj7-xdv,Chevron,Gasoline Stations,447110.0,220870302045.0
222-224@8dy-qtg-mzf,Cafe Aquarius,Restaurants and Other Eating Places,722515.0,220719801001.0
224-222@8dy-qv6-35z,Fair Grinds,Restaurants and Other Eating Places,722515.0,220710019003.0
224-225@8dy-rfh-yn5,Delta,Gasoline Stations,447110.0,220710102001.0
225-222@8dy-r9j-nbk,Pilot and Powell,Clothing Stores,4481.0,220710099002.0
226-222@8dy-qv9-ygk,Nola Food Mart,Grocery Stores,445110.0,220710004002.0
227-222@8dy-rf7-fs5,Sherwin-Williams,Building Material and Supplies Dealers,444120.0,220710129001.0
228-222@8dy-r9j-7yv,Craft Beer Cellar,"Beer, Wine, and Liquor Stores",445310.0,220710090002.0
228-222@8dy-rf7-68v,Dollar General,"General Merchandise Stores, including Warehouse Clubs and Supercenters",452319.0,220710072001.0
22c-223@8dy-rfb-5j9,Finn McCool's Irish Pub,Drinking Places (Alcoholic Beverages),722410.0,220710064002.0
22d-222@8dy-rfx-xdv,Parlons Cafe,Restaurants and Other Eating Places,722515.0,220510224002.0
22g-222@8dy-rbc-6rk,Word Of Truth Fellowship,Religious Organizations,813110.0,220710006172.0
22h-222@8dy-qsh-vcq,Vibe Barber Shop,Personal Care Services,81211.0,220710013011.0
22m-222@8dy-qtz-26k,Mojo Lounge,Restaurants and Other Eating Places,722511.0,220710038002.0
22m-222@8dy-rfh-mtv,Domino's Pizza,Restaurants and Other Eating Places,722513.0,220710111002.0
22p-222@8dy-qtz-k4v,St James Cheese Company Warehouse District,Specialty Food Stores,445210.0,220710134001.0
22p-222@8dy-r9f-kfz,Frankie & Johnny's,Restaurants and Other Eating Places,722511.0,220710114001.0
22q-222@8dy-qvg-7nq,Celtica French Bakery,Bakeries and Tortilla Manufacturing,311811.0,220710056014.0
22q-222@8dy-r9j-m6k,Snowizard Snoball Stand,Restaurants and Other Eating Places,722515.0,220710099002.0
22s-223@8dy-qv8-p7q,The Center For Health and Healing,Offices of Other Health Practitioners,621330.0,220710134002.0
22y-222@8dy-qv2-b49,Gabrielle Restaurant,Restaurants and Other Eating Places,722511.0,220710044012.0
233-222@8dy-qty-zvf,Artist's Market,Other Miscellaneous Store Retailers,453920.0,220710038002.0
233-222@8dy-qvn-73q,Santa Fe,Restaurants and Other Eating Places,722511.0,220710037026.0
233-223@8dy-qv3-jqf,Irish Cultural Museum of New Orleans,"Museums, Historical Sites, and Similar Institutions",712110.0,220710135003.0
23c-222@8dy-qtz-2hq,Royal Barracks Guest House,Traveler Accommodation,721110.0,220710038002.0
zzw-222@8dy-qsm-t5f,Bayou Bienvenue Wetland Triangle,Other Amusement and Recreation Industries,713940.0,220719801001.0
zzw-222@8dy-qv8-tjv,Smoothies N Things Cafe,Restaurants and Other Eating Places,722515.0,220710060001.0
zzw-222@8dy-r4j-bhq,The Home Depot,Building Material and Supplies Dealers,444130.0,220710017472.0
zzw-228@8dy-qw3-n5z,Subway,Restaurants and Other Eating Places,722513.0,220710006061.0
zzw-22k@8dy-qv3-hkf,Serebro Leonard H Dr,General Medical and Surgical Hospitals,622110.0,220710134003.0
zzy-223@8dy-qsh-y9z,Desire Florida Mental Health Clinic,Offices of Other Health Practitioners,621399.0,220710014015.0
